"English Word","POS","Level","Chinese Translation","Example Sentence","Self-Examine Prompt"
"fill","v.","A1","装满","Fill the glass with water.","What do you fill with water?"
"film","n.","A1","电影","I watched a good film last night.","What is your favourite film?"
"final","adj.","A1","最终的","This is the final answer.","When do you use 'final'?"
"find","v.","A1","找到","I can't find my keys.","What do you often find difficult to find?"
"fine","adj.","A1","好的；晴朗的","The weather is fine today.","When do you say 'I'm fine'?"
"finish","v.","A1","完成","Please finish your homework.","What time do you finish school?"
"fire","n.","A1","火","Fire is hot and dangerous.","What do you cook over a fire?"
"first","det./number, adv.","A1","第一","This is my first day at school.","What was your first pet?"
"fish","n.","A1","鱼","Fish live in water.","Do you like eating fish?"
"five","number","A1","五","I have five fingers on each hand.","What comes before five?"
"flat","n.","A1","公寓","I live in a small flat.","What is the difference between a flat and a house?"
"flight","n.","A1","航班","My flight is at 3 PM.","How long is your flight to another country?"
"floor","n.","A1","地板；楼层","The book is on the floor.","What floor do you live on?"
"flower","n.","A1","花","The flower smells beautiful.","What is your favorite flower?"
"fly","v.","A1","飞","Birds can fly in the sky.","What animals can fly?"
"follow","v.","A1","跟随","Please follow me.","Who do you follow on social media?"
"food","n.","A1","食物","I love Italian food.","What is your favorite food?"
"foot","n.","A1","脚","I hurt my foot while running.","How many feet do you have?"
"football","n.","A1","足球","I play football with my friends.","Do you like watching football?"
"for","prep.","A1","为了；给","This gift is for you.","What different ways can you use 'for'?"
"forget","v.","A1","忘记","Don't forget to call me.","What do you often forget?"
"form","n., v.","A1","形式；形成","Please fill out this form.","What forms do you fill out?"
"forty","number","A1","四十","She is forty years old.","What is forty plus ten?"
"four","number","A1","四","I have four sisters.","What comes after four?"
"fourteen","number","A1","十四","My brother is fourteen.","What is fourteen minus four?"
"fourth","number","A1","第四","April is the fourth month.","What is the fourth letter of the alphabet?"
"free","adj.","A1","免费的；自由的","The museum is free today.","What things are free?"
"Friday","n.","A1","星期五","I love Friday because it's weekend soon.","What do you do on Friday nights?"
"friend","n.","A1","朋友","She is my best friend.","How many friends do you have?"
"friendly","adj.","A1","友好的","Our neighbors are very friendly.","Who is the most friendly person you know?"
"from","prep.","A1","从；来自","I come from China.","Where do you come from?"
"front","n., adj.","A1","前面","The teacher stands in front of the class.","What is in front of your house?"
"fruit","n.","A1","水果","Apples and oranges are fruit.","What is your favorite fruit?"
"full","adj.","A1","满的","The glass is full of water.","When do you feel full?"
"fun","n.","A1","乐趣","Swimming is fun.","What do you do for fun?"
"funny","adj.","A1","有趣的","That joke was very funny.","What makes you laugh and find funny?"
"future","n.","A1","未来","I want to be a doctor in the future.","What do you want to do in the future?"
"game","n.","A1","游戏；比赛","Let's play a game.","What games do you like to play?"
"garden","n.","A1","花园","There are beautiful flowers in the garden.","Do you have a garden?"
"geography","n.","A1","地理","I study world geography.","What do you learn in geography class?"
"get","v.","A1","得到；到达","I get up at 7 AM.","What time do you get home?"
"girl","n.","A1","女孩","The girl is reading a book.","What is the opposite of 'girl'?"
"girlfriend","n.","A1","女朋友","He has a new girlfriend.","What does 'girlfriend' mean?"
"give","v.","A1","给","Please give me the book.","What do you give people on their birthday?"
"glass","n.","A1","玻璃；玻璃杯","The window is made of glass.","What do you drink from a glass?"
"go","v.","A1","去","I go to school every day.","Where do you go on weekends?"
"good","adj.","A1","好的","This is a very good book.","What is good about today?"
"goodbye","exclam./n.","A1","再见","Goodbye! See you later.","When do you say goodbye?"
"grandfather","n.","A1","祖父；外祖父","My grandfather is 80 years old.","What does your grandfather do?"
"grandmother","n.","A1","祖母；外祖母","My grandmother makes delicious cookies.","Do you visit your grandmother often?"
"grandparent","n.","A1","祖父母；外祖父母","I love spending time with my grandparents.","What do you do with your grandparents?"
"great","adj.","A1","很好的；伟大的","That's a great idea!","What was great about your weekend?"
"green","adj., n.","A1","绿色的","Grass is green.","What things in nature are green?"
"grey","adj., n.","A1","灰色的","The sky is grey today.","What things are grey?"
"group","n.","A1","组；群体","We work in a group of five.","What groups are you part of?"
"grow","v.","A1","成长；种植","Children grow quickly.","What grows in your garden?"
"guess","v., n.","A1","猜测","Can you guess my age?","When do you have to guess something?"
"guitar","n.","A1","吉他","I play the guitar.","Do you know how to play guitar?"
"gym","n.","A1","体育馆；健身房","I exercise at the gym.","Do you go to a gym?"
"hair","n.","A1","头发","She has long black hair.","What color is your hair?"
"half","n., det./pron.","A1","一半","I ate half of the pizza.","What is half of ten?"
"hand","n.","A1","手","I write with my right hand.","What do you do with your hands?"
"happen","v.","A1","发生","What will happen next?","What happened yesterday?"
"happy","adj.","A1","快乐的","I am very happy today.","What makes you happy?"
"hard","adj., adv.","A1","硬的；困难的","This math problem is hard.","What is hard for you to do?"
"hat","n.","A1","帽子","I wear a hat in the sun.","When do you wear a hat?"
"hate","v.","A1","讨厌","I hate getting up early.","What do you hate doing?"
"have","v.","A1","有","I have two brothers.","What do you have in your bag?"
"have to","modal v.","A1","必须","I have to go to school.","What do you have to do every day?"
"he","pron.","A1","他","He is my brother.","When do you use 'he'?"
"head","n.","A1","头","I have a headache.","What do you put on your head?"
"health","n.","A1","健康","Exercise is good for your health.","How do you keep good health?"
"healthy","adj.","A1","健康的","Vegetables are healthy food.","What healthy food do you eat?"
"hear","v.","A1","听见","I can hear music.","What can you hear right now?"
"hello","exclam./n.","A1","你好","Hello! How are you?","When do you say hello?"
"help","v., n.","A1","帮助","Can you help me?","Who do you help at home?"
"her","pron., det.","A1","她的；她","This is her book.","When do you use 'her'?"
"here","adv.","A1","这里","Come here, please.","What is here in this room?"
"hey","exclam.","A1","嘿","Hey! Wait for me!","When do you say 'hey'?"
"hi","exclam.","A1","嗨","Hi! Nice to meet you.","Is 'hi' the same as 'hello'?"
"high","adj.","A1","高的","The mountain is very high.","What is high in your city?"
"him","pron.","A1","他","I gave the book to him.","When do you use 'him' instead of 'he'?"
"his","det.","A1","他的","This is his car.","What is his favorite color?"
"history","n.","A1","历史","I study Chinese history.","What period of history interests you?"
"hobby","n.","A1","爱好","Reading is my hobby.","What is your favorite hobby?"
"holiday","n.","A1","假期","Summer holiday is coming.","What do you do during holidays?"
"home","n., adv.","A1","家；回家","I go home after school.","What time do you get home?"
"homework","n.","A1","家庭作业","I do my homework after school.","When do you do your homework?"
"hope","v.","A1","希望","I hope you feel better soon.","What do you hope for in the future?"
"horse","n.","A1","马","The horse runs very fast.","Have you ever ridden a horse?"
"hospital","n.","A1","医院","The hospital is near my house.","When do people go to hospital?"
"hot","adj.","A1","热的","Today is very hot.","What do you do when it's hot?"
"hotel","n.","A1","酒店","We stayed at a nice hotel.","What do you expect from a good hotel?"
"hour","n.","A1","小时","The meeting lasts one hour.","How many hours do you sleep?"
"house","n.","A1","房子","I live in a big house.","How many rooms are in your house?"
"how","adv.","A1","如何；怎样","How are you today?","How do you ask for help?"
"however","adv.","A1","然而","It's raining; however, I'll go out.","When do you use 'however'?"
"hundred","number","A1","一百","There are one hundred students.","What is one hundred minus fifty?"
"hungry","adj.","A1","饿的","I am very hungry.","What do you eat when you're hungry?"
"husband","n.","A1","丈夫","Her husband is a teacher.","What does a good husband do?"
"I","pron.","A1","我","I like to read books.","When do you use 'I' in sentences?"
"ice","n.","A1","冰","The ice is very cold.","What do you do with ice?"
"ice cream","n.","A1","冰淇淋","I love chocolate ice cream.","What is your favorite ice cream flavor?"
"idea","n.","A1","想法；主意","That's a great idea!","What gives you new ideas?"
"if","conj.","A1","如果","If it rains, I'll stay home.","When do you use 'if'?"
"imagine","v.","A1","想象","Imagine you can fly.","What do you like to imagine?"
"important","adj.","A1","重要的","Health is very important.","What is important to you?"
"improve","v.","A1","改善；提高","I want to improve my English.","How can you improve your skills?"
"in","prep., adv.","A1","在...里面","The book is in my bag.","What is in your pocket?"
"include","v.","A1","包括","The price includes breakfast.","What does your lunch include?"
"information","n.","A1","信息","I need more information.","Where do you get information?"
"interest","n., v.","A1","兴趣；使感兴趣","Music is my main interest.","What interests you most?"
"interested","adj.","A1","感兴趣的","I'm interested in science.","What are you interested in?"
"interesting","adj.","A1","有趣的","This book is very interesting.","What makes something interesting?"
"internet","n.","A1","互联网","I use the internet every day.","What do you do on the internet?"
"interview","n., v.","A1","面试；采访","I have a job interview tomorrow.","How do you prepare for an interview?"
"into","prep.","A1","进入","The cat jumped into the box.","What do you put into your bag?"
"introduce","v.","A1","介绍","Let me introduce my friend.","How do you introduce yourself?"
"island","n.","A1","岛屿","Japan is an island country.","What islands do you know?"
"it","pron.","A1","它","The dog is cute. It is brown.","When do you use 'it'?"
"its","det.","A1","它的","The cat licked its paw.","What is the difference between 'it's' and 'its'?"
"jacket","n.","A1","夹克","I wear a jacket when it's cold.","What color is your jacket?"
"January","n.","A1","一月","January is the first month.","What do you do in January?"
"jeans","n.","A1","牛仔裤","I like wearing blue jeans.","Do you prefer jeans or other pants?"
"job","n.","A1","工作","I have a new job.","What job do you want?"
"join","v.","A1","加入；参加","Would you like to join us?","What clubs did you join?"
"journey","n.","A1","旅程","The journey takes two hours.","What was your longest journey?"
"juice","n.","A1","果汁","I drink orange juice for breakfast.","What juice do you like best?"
"July","n.","A1","七月","July is very hot.","What do you do in July?"
"June","n.","A1","六月","School ends in June.","What happens in June?"
"just","adv.","A1","刚刚；只是","I just arrived home.","When do you use 'just'?"
"keep","v.","A1","保持；保留","Keep the change.","What do you keep in your room?"
"key","n., adj.","A1","钥匙；关键的","I lost my house key.","What do you use keys for?"
"kilometre","n.","A1","千米；公里","The school is two kilometres away.","How many kilometres do you walk daily?"
"kind (type)","n.","A1","种类","What kind of music do you like?","What kind of books do you read?"
"kitchen","n.","A1","厨房","I cook food in the kitchen.","What do you do in the kitchen?"
"know","v.","A1","知道；了解","I know your name.","What do you know about China?"
"land","n.","A1","土地；陆地","Farmers work on the land.","What animals live on land?"
"language","n.","A1","语言","English is an international language.","How many languages do you speak?"
"large","adj.","A1","大的","London is a large city.","What is large in your house?"
"last1 (final)","det.","A1","最后的","This is the last question.","What did you do last weekend?"
"late","adj., adv.","A1","晚的；迟的","I am late for school.","When are you usually late?"
"later","adv.","A1","后来；稍后","See you later!","What will you do later today?"
"laugh","v., n.","A1","笑","The joke made me laugh.","What makes you laugh?"
"learn","v.","A1","学习","I learn English every day.","What do you want to learn?"
"leave","v.","A1","离开","I leave home at 8 AM.","What time do you leave school?"
"left","adj., adv., n.","A1","左边的","Turn left at the corner.","What is on your left side?"
"leg","n.","A1","腿","I hurt my leg playing football.","How many legs does a chair have?"
"lesson","n.","A1","课程","The math lesson is difficult.","What is your favorite lesson?"
"let","v.","A1","让；允许","Let me help you.","When do parents let children play?"
"letter","n.","A1","信；字母","I wrote a letter to my friend.","How many letters are in the alphabet?"
"library","n.","A1","图书馆","I borrow books from the library.","How often do you visit the library?"
"lie1","v.","A1","躺；说谎","Don't lie to me.","Where do you lie down to rest?"
"life","n.","A1","生活；生命","Life is beautiful.","What do you love about life?"
"light (from the sun/a lamp)","n., adj.","A1","光；轻的","Turn on the light, please.","What gives us natural light?"
"like (similar)","prep.","A1","像","She looks like her mother.","Who do you look like?"
"like (find sb/sth pleasant)","v.","A1","喜欢","I like chocolate ice cream.","What food do you like most?"
"line","n.","A1","线；行","Please wait in line.","When do you stand in line?"
"lion","n.","A1","狮子","The lion is the king of animals.","Where do lions live?"
"list","n., v.","A1","清单；列出","Make a shopping list.","What is on your to-do list?"
"listen","v.","A1","听","Listen to the teacher.","What do you like to listen to?"
"little","adj., det./pron.","A1","小的；少的","The baby is very little.","What is the difference between 'little' and 'small'?"
"live1","v.","A1","居住；生活","I live in Beijing.","Where do you live?"
"local","adj.","A1","当地的","I shop at the local market.","What local food do you like?"
"long1","adj., adv.","A1","长的","She has long hair.","What is long in your room?"
"look","v.","A1","看","Look at this picture.","What do you look at every morning?"
"lose","v.","A1","丢失；失败","Don't lose your keys.","What do you often lose?"
"lot","pron., det., adv.","A1","许多","I have a lot of friends.","What do you do a lot?"
"love","n., v.","A1","爱；喜爱","I love my family.","What do you love doing?"
"lunch","n.","A1","午餐","I eat lunch at 12 o'clock.","What do you have for lunch?"
"machine","n.","A1","机器","This machine makes coffee.","What machines do you use daily?"
"magazine","n.","A1","杂志","I read a fashion magazine.","What magazines do you read?"
"main","adj.","A1","主要的","The main street is very busy.","What is the main problem?"
"make","v.","A1","制作；使","I make breakfast every morning.","What do you make for dinner?"
"man","n.","A1","男人","The man is wearing a suit.","What is the opposite of 'man'?"
"many","det./pron.","A1","许多","Many people like music.","How many books do you have?"
"map","n.","A1","地图","I use a map to find my way.","When do you use a map?"
"March","n.","A1","三月","Spring starts in March.","What happens in March?"
"market","n.","A1","市场","I buy vegetables at the market.","What do you buy at the market?"
"married","adj.","A1","已婚的","My sister is married.","What does it mean to be married?"
"match (contest/correspond)","n., v.","A1","比赛；匹配","The football match was exciting.","What sports matches do you watch?"
"May","n.","A1","五月","May is a beautiful month.","What do you do in May?"
"maybe","adv.","A1","也许","Maybe it will rain tomorrow.","When do you say 'maybe'?"
"me","pron.","A1","我（宾格）","Please help me.","When do you use 'me' instead of 'I'?"
"meal","n.","A1","一餐","Breakfast is my favorite meal.","What is your biggest meal of the day?"
"mean","v.","A1","意思是","What does this word mean?","What do you mean by that?"
"meaning","n.","A1","意思；含义","I don't understand the meaning.","What is the meaning of 'friend'?"
"meat","n.","A1","肉","I don't eat meat.","What meat do you like?"
"meet","v.","A1","见面；遇见","Nice to meet you!","Where do you meet your friends?"
"meeting","n.","A1","会议","I have a meeting at 2 PM.","What happens in a meeting?"
"member","n.","A1","成员","I am a member of the club.","What groups are you a member of?"
"menu","n.","A1","菜单","Can I see the menu, please?","What is on your favorite restaurant's menu?"
"message","n.","A1","消息；信息","I sent you a message.","How do you send messages?"
"metre","n.","A1","米","The table is one metre long.","How many metres tall are you?"
"midnight","n.","A1","午夜","The party ends at midnight.","What do you do at midnight?"
"mile","n.","A1","英里","The school is two miles away.","How many miles do you walk?"
"milk","n.","A1","牛奶","I drink milk every morning.","What do you eat with milk?"
"million","number","A1","百万","One million is a big number.","What costs a million dollars?"
"minute1","n.","A1","分钟","Wait a minute, please.","How many minutes are in an hour?"
"miss","v.","A1","想念；错过","I miss my family.","What do you miss most?"
"mistake","n.","A1","错误","I made a mistake.","What mistakes do you often make?"
"model","n.","A1","模型；模特","She is a fashion model.","What is a model airplane?"
"modern","adj.","A1","现代的","I like modern art.","What modern things do you use?"
"moment","n.","A1","时刻；片刻","Wait a moment, please.","What was your happiest moment?"
"Monday","n.","A1","星期一","I don't like Monday mornings.","What do you do on Monday?"
"money","n.","A1","钱","I need to save money.","What do you spend money on?"
"month","n.","A1","月","January is the first month.","What is your favorite month?"
"more","det./pron., adv.","A1","更多","I want more cake.","What do you want more of?"
"morning","n.","A1","早晨","Good morning!","What do you do every morning?"
"most","det./pron., adv.","A1","最多；大部分","Most people like holidays.","What do you do most often?"
"mother","n.","A1","母亲","My mother is a doctor.","What does your mother do?"
"mountain","n.","A1","山","The mountain is very high.","Have you ever climbed a mountain?"
"mouse","n.","A1","老鼠","The cat caught a mouse.","Are you afraid of mice?"
"mouth","n.","A1","嘴巴","Open your mouth, please.","What do you do with your mouth?"
"move","v.","A1","移动；搬家","Please move your chair.","When did you last move house?"
"movie","n.","A1","电影","Let's watch a movie tonight.","What movie do you want to see?"
"much","det./pron., adv.","A1","很多；非常","I don't have much time.","How much money do you have?"
"mum","n.","A1","妈妈","I love my mum.","What do you call your mum?"
"museum","n.","A1","博物馆","The museum has old paintings.","What museums have you visited?"
"music","n.","A1","音乐","I listen to music every day.","What music do you like?"
"must","modal v.","A1","必须","You must do your homework.","What must you do every day?"
"my","det.","A1","我的","This is my book.","What is in my bag?"
"name","n., v.","A1","名字；命名","What's your name?","How do you spell your name?"
"natural","adj.","A1","自然的","I like natural food.","What natural things do you see?"
"near","prep., adj., adv.","A1","在...附近","The school is near my house.","What is near your home?"
"need","v.","A1","需要","I need help with this.","What do you need to buy?"
"negative","adj.","A1","否定的；消极的","Don't be so negative.","What is the negative of 'yes'?"
"neighbour","n.","A1","邻居","My neighbour is very friendly.","Do you know your neighbours?"
"never","adv.","A1","从不","I never eat meat.","What do you never do?"
"new","adj.","A1","新的","I have a new phone.","What new things do you want?"
"news","n.","A1","新闻","I watch the news every evening.","Where do you get news?"
"newspaper","n.","A1","报纸","I read the newspaper every morning.","Do you still read newspapers?"
"next","adj., adv.","A1","下一个","Next week I'm going on holiday.","What are you doing next?"
"next to","prep.","A1","在...旁边","The bank is next to the post office.","What is next to your house?"
"nice","adj.","A1","好的；美好的","Have a nice day!","What was nice about today?"
"night","n.","A1","夜晚","Good night!","What do you do at night?"
"nine","number","A1","九","I have nine books.","What comes after nine?"
"nineteen","number","A1","十九","She is nineteen years old.","What is nineteen plus one?"
"ninety","number","A1","九十","My grandmother is ninety.","What is ninety minus ten?"
"no","exclam., det.","A1","不；没有","No, thank you.","When do you say 'no'?"
"no one","pron.","A1","没有人","No one was at home.","When is no one around?"
"nobody","pron.","A1","没有人","Nobody likes rainy days.","What does nobody want to do?"
"north","n., adj., adv.","A1","北方","Canada is north of the USA.","What is north of your city?"
"nose","n.","A1","鼻子","I can smell with my nose.","What do you use your nose for?"
"not","adv.","A1","不","I am not hungry.","When do you use 'not'?"
"note","n.","A1","笔记；便条","I wrote a note to remember.","What notes do you take?"
"nothing","pron.","A1","什么都没有","There's nothing in the box.","When do you have nothing to do?"
"November","n.","A1","十一月","November is cold.","What happens in November?"
"now","adv.","A1","现在","I am busy now.","What are you doing now?"
"number","n.","A1","数字；号码","What's your phone number?","What is your lucky number?"
"nurse","n.","A1","护士","The nurse helps the doctor.","What does a nurse do?"
"object","n.","A1","物体","What is this object?","What objects are on your desk?"
"o'clock","adv.","A1","...点钟","It's three o'clock.","What time is it o'clock?"
"October","n.","A1","十月","October has 31 days.","What do you do in October?"
"of","prep.","A1","...的","This is a photo of my family.","What are some uses of 'of'?"
"off","adv., prep.","A1","离开；关闭","Turn off the light.","When do you turn things off?"
"office","n.","A1","办公室","I work in an office.","What is in an office?"
"often","adv.","A1","经常","I often go to the cinema.","What do you often do?"
"oh","exclam.","A1","哦","Oh, I forgot my keys!","When do you say 'oh'?"
"OK","exclam., adj./adv.","A1","好的","OK, let's go.","When do you say 'OK'?"
"old","adj.","A1","老的；旧的","My grandfather is very old.","What old things do you have?"
"on","prep., adv.","A1","在...上面","The book is on the table.","What is on your desk right now?"
"once","adv.","A1","一次；曾经","I go swimming once a week.","What do you do once a day?"
"one","number/det., pron.","A1","一","I have one sister.","What is one plus one?"
"onion","n.","A1","洋葱","Onions make me cry.","Do you like onions?"
"online","adj., adv.","A1","在线的","I shop online.","What do you do online?"
"only","adj., adv.","A1","只有；仅仅","I have only one brother.","When do you use 'only'?"
"open","adj., v.","A1","开着的；打开","Please open the window.","What time do shops open?"
"opinion","n.","A1","意见；观点","What's your opinion about this?","Do you have a strong opinion?"
"opposite","adj., n., prep., adv.","A1","相反的；对面","The bank is opposite the school.","What is the opposite of 'hot'?"
"or","conj.","A1","或者","Do you want tea or coffee?","When do you use 'or'?"
"orange","n., adj.","A1","橙子；橙色的","I like orange juice.","What things are orange?"
"order","n., v.","A1","订购；命令","I want to order pizza.","What do you order at restaurants?"
"other","adj./pron.","A1","其他的","The other students are coming.","What other languages do you speak?"
"our","det.","A1","我们的","This is our house.","What is special about our school?"
"out","adv./prep.","A1","外面；出去","Let's go out for dinner.","What do you do when you go out?"
"outside","adv.","A1","在外面","It's cold outside.","What do you see outside your window?"
"over","prep., adv.","A1","在...上方；结束","The plane flies over the city.","When is your class over?"
"own","adj./pron.","A1","自己的","I have my own room.","What do you own?"
"page","n.","A1","页","Turn to page 10.","How many pages are in your book?"
"paint","v., n.","A1","油漆；画画","I paint pictures in art class.","What colors do you paint with?"
"painting","n.","A1","绘画；画作","This painting is beautiful.","What painting do you like?"
"pair","n.","A1","一对；一双","I need a new pair of shoes.","What things come in pairs?"
"paper","n.","A1","纸","I write on white paper.","What do you do with paper?"
"paragraph","n.","A1","段落","Write one paragraph about yourself.","How many sentences are in a paragraph?"
"parent","n.","A1","父母","My parents are teachers.","What do your parents do?"
