"English Word","POS","Level","Chinese Translation","Example Sentence","Self-Examine Prompt"
"when","adv., pron., conj.","A1","什么时候","When do you go to bed?","When do you feel happy?"
"where","adv., conj.","A1","在哪里","Where do you live?","Where do you want to go?"
"which","pron./det.","A1","哪个","Which book do you like?","Which color do you prefer?"
"white","adj., n.","A1","白色的","I have a white shirt.","What things are white?"
"who","pron.","A1","谁","Who is your teacher?","Who do you live with?"
"why","adv.","A1","为什么","Why are you late?","Why do you study English?"
"wife","n.","A1","妻子","She is his wife.","What does a good wife do?"
"will","modal v.","A1","将要","I will help you.","What will you do tomorrow?"
"win","v.","A1","赢；获胜","Our team will win.","What games do you win?"
"window","n.","A1","窗户","Open the window, please.","What can you see from your window?"
"wine","n.","A1","酒；葡萄酒","Adults drink wine with dinner.","What do children drink instead of wine?"
"winter","n.","A1","冬天","Winter is cold.","What do you do in winter?"
"with","prep.","A1","和；用","I go to school with my friends.","What do you do with your family?"
"without","prep.","A1","没有","I can't live without music.","What can't you live without?"
"woman","n.","A1","女人","The woman is wearing a red dress.","What is the opposite of 'woman'?"
"wonderful","adj.","A1","精彩的；美妙的","What a wonderful day!","What is wonderful about life?"
"word","n.","A1","单词","I learned a new word today.","What word do you use most?"
"work","v., n.","A1","工作","I work in an office.","What work do you do?"
"worker","n.","A1","工人","The worker is very tired.","What do workers do?"
"world","n.","A1","世界","I want to see the world.","What countries in the world interest you?"
"would","modal v.","A1","会；将","I would like some tea.","What would you like to do?"
"write","v.","A1","写","I write in my diary.","What do you write about?"
"writer","n.","A1","作家","She is a famous writer.","What writers do you know?"
"writing","n.","A1","写作","I like creative writing.","What writing do you do?"
"wrong","adj.","A1","错误的","This answer is wrong.","What is the opposite of 'wrong'?"
"yeah","exclam.","A1","是的（非正式）","Yeah, I agree with you.","When do you say 'yeah'?"
"year","n.","A1","年","I am twenty years old.","What year were you born?"
"yellow","adj., n.","A1","黄色的","The sun is yellow.","What things are yellow?"
"yes","exclam.","A1","是的","Yes, I can help you.","When do you say 'yes'?"
"yesterday","adv., n.","A1","昨天","Yesterday was sunny.","What did you do yesterday?"
"you","pron.","A1","你","How are you today?","When do you use 'you'?"
"young","adj.","A1","年轻的","She is very young.","What is the opposite of 'young'?"
"your","det.","A1","你的","What is your name?","What is your favorite color?"
"yourself","pron.","A1","你自己","Take care of yourself.","What do you do by yourself?"
